case_id,case_type,system_name,input_status,standard_baseline,component_description,constituent_keys,total_energy_MeV,invariant_mass_MeV_c2,constituent_rest_mass_sum_MeV_c2,mass_gap_MeV_c2,mass_gap_fraction_of_system_mass,standard_interpretation,structural_boundedness_level,mass_describability_class,structural_reading,source_ids,source_note,caution_note
A001,free_radiation,single_photon,standard_baseline_ready,massless individual radiation component; no rest frame,single photon baseline from PDG mass table,photon,,0,0,0,,"Energy can be present in radiation, but an individual photon has no rest-mass description.",unbounded_or_free,energy_present_but_no_individual_rest_mass_description,energy present but not mass-describable as a bounded rest structure,PDG_MASS_WIDTH_2025,PDG photon mass entry used only as standard baseline.,No claim is made that photon mass is generated or modified.
B001,bounded_radiation_system,opposite_direction_photon_pair,requires_parameter_for_energy,system invariant mass can be defined if total momentum is zero,two photons with opposite momenta; energy scale to be supplied in standard stage,photon;photon,,,0,,,A two-photon system may have a system-level invariant mass if its total momentum vanishes.,system_closed_momentum,system_mass_describable_after_energy_parameter,massless components may form a system-level mass-describable configuration,PDG_MASS_WIDTH_2025;NIST_CODATA_2022_ALLASCII,Requires later standard calculation using supplied photon energies and energy-momentum relation.,This is not individual photon rest mass; it is system invariant mass.
C001P,qcd_confined_hadron,proton,standard_baseline_ready,proton rest mass compared with minimal u+u+d quark mass reference,QCD-confined hadronic structure; minimal quark mass reference only,up_quark;up_quark;down_quark,,938.27208816,9.02,929.25208816,0.990386583898,The proton mass is not exhausted by the minimal current-quark mass reference.,qcd_confined,rest_mass_confined_hadron,QCD-confined structural energy may be read as a bounded mass-describable configuration without replacing QCD.,PDG_MASS_WIDTH_2025,"PDG masses used as standard input. Quark masses are reference values, not a complete QCD decomposition.",Do not treat the mass gap as a derived proof of the theory; it is a standard-baseline comparison variable.
C001N,qcd_confined_hadron,neutron,standard_baseline_ready,neutron rest mass compared with minimal u+d+d quark mass reference,QCD-confined hadronic structure; minimal quark mass reference only,up_quark;down_quark;down_quark,,939.5654205,11.56,928.0054205,0.987696439494,The neutron mass is not exhausted by the minimal current-quark mass reference.,qcd_confined,rest_mass_confined_hadron,QCD-confined structural energy may be read as a bounded mass-describable configuration without replacing QCD.,PDG_MASS_WIDTH_2025,"PDG masses used as standard input. Quark masses are reference values, not a complete QCD decomposition.",Do not treat the mass gap as a derived proof of the theory; it is a standard-baseline comparison variable.
D001,annihilation_transition,electron_positron_annihilation_threshold,standard_baseline_ready,QED baseline preserved; threshold rest-energy reference from electron mass,electron and positron rest-mass reference before radiative final-state description,electron;positron_mass_equal_to_electron,1.0219979,1.0219979,1.0219979,0,0,"At threshold, the initial rest-energy scale is twice the electron rest mass; QED is not replaced.",transition_case,bounded_massive_to_radiative_structure,transition from massive particle description to radiative final-state description,PDG_MASS_WIDTH_2025;NIST_CODATA_2022_ALLASCII,Electron mass used only for standard threshold reference.,"No claim is made about deriving QED, photon production rules, spin rules, or decay rates."
